[I 2026-03-29 04:45:34,013] Trial 26 finished with value: 26.50427263993602 and parameters: {'w_wait': 2.447469535244195, 'w_ride': 1.3062773236441905, 'w_rejection': 8.484509064409078, 'lr_start': 0.00017456283603956756, 'lr_schedule': 'linear', 'gamma': 0.9959984242586373, 'ent_coef': 0.03452266051387687}. Best is trial 23 with value: 26.129941986675927.

  Trial 27 result:
    score:          26.504
    service_rate:   88.8%
    mean_wait_all:  20.81 min
    mean_wait_svd:  10.14 min
    mean_ride:      8.60 min
    p95_wait:       28.01 min
    rejected:       38.2
    train_time:     392s
  >>> Best: trial 24  score=26.130  wait_all=20.43  svc=89.5%

  --- Trial 28 ---
    Reward:  w_wait=2.22  w_ride=1.16  w_rej=8.21
    PPO:     lr=0.00012(linear)  gamma=0.9933  ent=0.0290
[I 2026-03-29 04:52:28,653] Trial 27 finished with value: 27.337531678790562 and parameters: {'w_wait': 2.2150990307808205, 'w_ride': 1.16103231830485, 'w_rejection': 8.205218562355212, 'lr_start': 0.00012322509404521373, 'lr_schedule': 'linear', 'gamma': 0.99329145866318, 'ent_coef': 0.028978969344293733}. Best is trial 23 with value: 26.129941986675927.

  Trial 28 result:
    score:          27.338
    service_rate:   89.1%
    mean_wait_all:  21.56 min
    mean_wait_svd:  11.26 min
    mean_ride:      8.72 min
    p95_wait:       28.35 min
    rejected:       37.3
    train_time:     400s
  >>> Best: trial 24  score=26.130  wait_all=20.43  svc=89.5%

  --- Trial 29 ---
    Reward:  w_wait=2.31  w_ride=1.29  w_rej=8.68
    PPO:     lr=0.00021(linear)  gamma=0.9943  ent=0.0203
[I 2026-03-29 04:59:21,754] Trial 28 finished with value: 27.147720186314338 and parameters: {'w_wait': 2.3073519146746713, 'w_ride': 1.2869396270374893, 'w_rejection': 8.682818474987046, 'lr_start': 0.00021376937959810392, 'lr_schedule': 'linear', 'gamma': 0.9942620712157534, 'ent_coef': 0.02025926777814974}. Best is trial 23 with value: 26.129941986675927.

  Trial 29 result:
    score:          27.148
    service_rate:   89.0%
    mean_wait_all:  21.37 min
    mean_wait_svd:  10.92 min
    mean_ride:      8.73 min
    p95_wait:       28.35 min
    rejected:       37.7
    train_time:     394s
  >>> Best: trial 24  score=26.130  wait_all=20.43  svc=89.5%

  --- Trial 30 ---
    Reward:  w_wait=2.11  w_ride=0.81  w_rej=8.55
    PPO:     lr=0.00011(linear)  gamma=0.9927  ent=0.0236
[I 2026-03-29 05:06:06,772] Trial 29 finished with value: 27.54496521092382 and parameters: {'w_wait': 2.109462851164621, 'w_ride': 0.8081906099466044, 'w_rejection': 8.546931849609194, 'lr_start': 0.00011356684169212026, 'lr_schedule': 'linear', 'gamma': 0.9926624929541663, 'ent_coef': 0.023586501271541233}. Best is trial 23 with value: 26.129941986675927.

  Trial 30 result:
    score:          27.545
    service_rate:   89.0%
    mean_wait_all:  21.75 min
    mean_wait_svd:  11.35 min
    mean_ride:      8.76 min
    p95_wait:       28.26 min
    rejected:       37.7
    train_time:     390s
  >>> Best: trial 24  score=26.130  wait_all=20.43  svc=89.5%

============================================================
SEARCH v3 COMPLETE
============================================================
  Time: 3.4 hours
  Trials: 30 valid / 30 total

  Metric                     Best
  --------------------------------
  score                    26.130
  service_rate             89.5%
  mean_wait_all            20.43
  mean_wait_served         10.39
  mean_ride                 8.59
  rejected                  36.1

  Config (trial #24):
    w_wait=2.418  w_ride=1.206  w_rej=8.464
    lr=0.000154(linear)  gamma=0.9947  ent=0.02659

  Saved: rl_outputs/tune_v3\best_config.json
  Saved: rl_outputs/tune_v3\all_trials.csv

  TOP 5:
  #      score   w_all    svc   wait  rej
  24    26.130  20.43 89.5%  10.39   36
  18    26.267  20.56 89.2%  10.28   37
  21    26.321  20.60 89.4%  10.51   36
  10    26.428  20.70 89.2%  10.46   37
  27    26.504  20.81 88.8%  10.14   38

  Next: python rl_train_from_tune.py --config rl_outputs/tune_v3\best_config.json